{
  "$schema": "https://json-schema.org/draft/2020-12/schema",
  "type": "object",
  "properties": {
    "schema": {
      "type": "string",
      "const": "quote@1"
    },
    "origin": {
      "type": "string",
      "minLength": 1,
      "description": "The source file (a reference) or the decision that produced this table (C04 R[0]); a table without it is code"
    },
    "description": {
      "description": "What the table checks, in the pack language",
      "type": "string"
    },
    "tier": {
      "description": "Tier of the outcomes (C05 R[1]); default blocking when a basis is given, else advisory. Blocking needs a basis",
      "type": "string",
      "enum": [
        "blocking",
        "advisory"
      ]
    },
    "basis": {
      "description": "The acceptance contract clause a blocking check relies on (C05 R[1])",
      "type": "string",
      "minLength": 1
    },
    "item": {
      "description": "Pointer to the item identity in the subject (or in each node); copied into outcomes",
      "type": "string",
      "pattern": "^(?:\\/(?:[^~/]|~[01])*)*$"
    },
    "location": {
      "description": "Pointer to the reference URI of the item in the judged source; becomes a ground of the outcomes",
      "type": "string",
      "pattern": "^(?:\\/(?:[^~/]|~[01])*)*$"
    },
    "quotes": {
      "minItems": 1,
      "type": "array",
      "items": {
        "type": "object",
        "properties": {
          "select": {
            "type": "string",
            "maxLength": 512,
            "pattern": "^\\$(?:\\.(?:\\*|[A-Za-z_\\u0080-￿][A-Za-z0-9_\\u0080-￿]*)|\\[(?:\\*|-?(?:0|[1-9][0-9]*)|'(?:[^'\\\\]|\\\\.)*'|\"(?:[^\"\\\\]|\\\\.)*\")\\])*$",
            "description": "Quotation objects in the subject"
          },
          "text": {
            "type": "string",
            "pattern": "^(?:\\/(?:[^~/]|~[01])*)*$",
            "description": "Pointer to the quoted text inside a quotation"
          },
          "reference": {
            "type": "string",
            "pattern": "^(?:\\/(?:[^~/]|~[01])*)*$",
            "description": "Pointer to the reference URI the quotation cites"
          }
        },
        "required": [
          "select",
          "text",
          "reference"
        ],
        "additionalProperties": false
      }
    }
  },
  "required": [
    "schema",
    "origin",
    "quotes"
  ],
  "additionalProperties": false,
  "title": "quote@1",
  "description": "Quotation table: every quotation must appear verbatim in the fragment its reference resolves to. Only white space differences are ignored: every run of Unicode White_Space collapses to one space and both ends are trimmed; case, punctuation, character width and normalization form stay significant, and an empty quotation never matches. A mismatch refutes with QUOTE_MISMATCH"
}
