{
  "schema": "quote@1",
  "tier": "blocking",
  "basis": "K03 R[6]",
  "quotes": [
    {
      "select": "$.slots.contribution[*].data.source",
      "text": "/quote",
      "reference": "/reference"
    },
    {
      "select": "$.slots.contribution[*].data.relation.other",
      "text": "/quote",
      "reference": "/reference"
    }
  ],
  "origin": "所有者 2026-10-23 知识库方向和 K03 R[4]-R[6]"
}
